{
  "schema_version": "1.0",
  "variant": "current",
  "meeting": {
    "id": "demo-meeting",
    "title": "Đề án — cuộc họp",
    "meeting_date": "2026-10-25",
    "duration_sec": 90.0
  },
  "speakers": [
    {
      "id": "s1",
      "name": "Người phụ trách"
    }
  ],
  "segments": [
    {
      "id": "seg1",
      "start_sec": 0.0,
      "end_sec": 5.0,
      "speaker_id": "s1",
      "text": "Nội dung đã sửa."
    },
    {
      "id": "seg2",
      "start_sec": 65.0,
      "end_sec": 70.0,
      "speaker_id": null,
      "text": "Ý kiến thứ hai."
    }
  ],
  "summary": {
    "overview": "Tổng quan đã sửa.",
    "key_points": [],
    "decisions": [
      {
        "text": "Chốt lịch.",
        "evidence_segment_ids": [
          "seg2"
        ]
      }
    ]
  },
  "action_items": [
    {
      "description": "Công việc đã sửa",
      "assignee_name": null,
      "due_date": null,
      "due_date_text": null,
      "id": "a1",
      "status": "done",
      "source": "ai"
    },
    {
      "description": "Việc người dùng thêm",
      "assignee_name": "Người phụ trách",
      "due_date": "2026-10-30",
      "due_date_text": "thứ Sáu",
      "id": "a2",
      "status": "open",
      "source": "user"
    }
  ]
}
